{
  "$schema": "https://json-schema.org/draft/2020-12/schema",
  "$id": "jobhunt.assessment-manifest/v1",
  "title": "Job Hunt assessment instrument manifest",
  "type": "object",
  "required": [
    "instrumentId", "instrumentVersion", "title", "description", "locale",
    "source", "definitionHash", "scoringVersion", "answerScale", "dimensions",
    "items", "interpretationLimits"
  ],
  "additionalProperties": false,
  "properties": {
    "instrumentId": { "type": "string", "minLength": 1 },
    "instrumentVersion": { "type": "string", "minLength": 1 },
    "title": { "type": "string", "minLength": 1 },
    "description": { "type": "string", "minLength": 1 },
    "locale": { "type": "string", "minLength": 2 },
    "source": { "type": "object" },
    "definitionHash": { "type": "string", "pattern": "^sha256:[0-9a-f]{64}$" },
    "scoringVersion": { "type": "string", "minLength": 1 },
    "answerScale": { "type": "object" },
    "dimensions": { "type": "array", "minItems": 1 },
    "items": { "type": "array", "minItems": 1 },
    "interpretationLimits": { "type": "array" }
  }
}
