{
  "instrumentId": "career-work-preferences",
  "instrumentVersion": "1.0.0",
  "title": "Career Work Preferences",
  "description": "A dashboard-native questionnaire for recording practical work preferences and career priorities.",
  "locale": "en",
  "source": {
    "name": "Cleaning Dashboard Job Hunt",
    "authoritativeReference": "docs/jobhunt-roadmap.md#pack-b---career-profile-and-assessments",
    "license": "Project-authored",
    "licenseReference": "Local project source",
    "attribution": "Cleaning Dashboard Career Work Preferences, version 1.0.0.",
    "requiredNotices": [
      "Dashboard-native, non-validated career preference questionnaire.",
      "Results describe stated preferences only and are not psychometric, clinical, or career recommendations."
    ]
  },
  "definitionHash": "sha256:d19dedc6a8b39f219542cc5ac79595e04064dff543baa635c6e7f09fd0fccab1",
  "scoringVersion": "direct-sum-v1",
  "answerScale": {
    "min": 1,
    "max": 5,
    "options": [
      { "value": 1, "label": "Strongly disagree" },
      { "value": 2, "label": "Disagree" },
      { "value": 3, "label": "Unsure / no preference" },
      { "value": 4, "label": "Agree" },
      { "value": 5, "label": "Strongly agree" }
    ]
  },
  "dimensions": [
    { "id": "deep_work", "label": "Deep work" },
    { "id": "interruption_tolerance", "label": "Interruption tolerance" },
    { "id": "context_switching", "label": "Context switching" },
    { "id": "predictable_workflow", "label": "Predictable workflow" },
    { "id": "autonomy", "label": "Autonomy" },
    { "id": "explicit_structure", "label": "Explicit structure" },
    { "id": "technical_problem_solving", "label": "Technical problem solving" },
    { "id": "coordination", "label": "Coordination" },
    { "id": "client_facing", "label": "Client-facing work" },
    { "id": "administrative_work", "label": "Administrative work" },
    { "id": "creative_work", "label": "Creative work" },
    { "id": "physical_work", "label": "Physical work" },
    { "id": "solo_work", "label": "Solo work" },
    { "id": "small_team", "label": "Small-team collaboration" },
    { "id": "frequent_meetings", "label": "Frequent meetings" },
    { "id": "customer_contact", "label": "Customer contact" },
    { "id": "people_management", "label": "People management" },
    { "id": "remote_work", "label": "Remote work" },
    { "id": "hybrid_work", "label": "Hybrid work" },
    { "id": "onsite_work", "label": "On-site work" },
    { "id": "shift_work", "label": "Shift work" },
    { "id": "evenings_weekends", "label": "Evenings or weekends" },
    { "id": "travel", "label": "Work travel" },
    { "id": "income", "label": "Income" },
    { "id": "stability", "label": "Stability" },
    { "id": "advancement", "label": "Advancement" },
    { "id": "learning", "label": "Learning" },
    { "id": "meaningful_work", "label": "Meaningful or interesting work" },
    { "id": "low_chaos", "label": "Low stress / low chaos" },
    { "id": "geographic_flexibility", "label": "Geographic flexibility" },
    { "id": "relocation", "label": "Relocation" }
  ],
  "items": [
    { "id": "cwp-01", "order": 1, "text": "I prefer workdays with long, uninterrupted blocks for one demanding task.", "dimension": "deep_work", "reverse": false },
    { "id": "cwp-02", "order": 2, "text": "I am comfortable being interrupted frequently while I work.", "dimension": "interruption_tolerance", "reverse": false },
    { "id": "cwp-03", "order": 3, "text": "I enjoy switching between several unrelated tasks during the day.", "dimension": "context_switching", "reverse": false },
    { "id": "cwp-04", "order": 4, "text": "I prefer a workload that is predictable from week to week.", "dimension": "predictable_workflow", "reverse": false },
    { "id": "cwp-05", "order": 5, "text": "I prefer deciding for myself how to organize and complete my work.", "dimension": "autonomy", "reverse": false },
    { "id": "cwp-06", "order": 6, "text": "I prefer roles with clear procedures and explicit expectations.", "dimension": "explicit_structure", "reverse": false },
    { "id": "cwp-07", "order": 7, "text": "I want technical problem solving to be a major part of my job.", "dimension": "technical_problem_solving", "reverse": false },
    { "id": "cwp-08", "order": 8, "text": "I enjoy coordinating tasks, schedules, or dependencies across people.", "dimension": "coordination", "reverse": false },
    { "id": "cwp-09", "order": 9, "text": "I want regular interaction with external clients to be part of my work.", "dimension": "client_facing", "reverse": false },
    { "id": "cwp-10", "order": 10, "text": "I am comfortable spending a substantial part of my day on administrative tasks.", "dimension": "administrative_work", "reverse": false },
    { "id": "cwp-11", "order": 11, "text": "I want creating new ideas or designs to be a regular part of my work.", "dimension": "creative_work", "reverse": false },
    { "id": "cwp-12", "order": 12, "text": "I would like a job that involves regular physical activity.", "dimension": "physical_work", "reverse": false },
    { "id": "cwp-13", "order": 13, "text": "I prefer completing most tasks independently.", "dimension": "solo_work", "reverse": false },
    { "id": "cwp-14", "order": 14, "text": "I prefer collaborating closely with a small, consistent team.", "dimension": "small_team", "reverse": false },
    { "id": "cwp-15", "order": 15, "text": "I am comfortable with several scheduled meetings on a typical workday.", "dimension": "frequent_meetings", "reverse": false },
    { "id": "cwp-16", "order": 16, "text": "I want frequent direct contact with customers or service users.", "dimension": "customer_contact", "reverse": false },
    { "id": "cwp-17", "order": 17, "text": "I want responsibility for leading and developing other employees.", "dimension": "people_management", "reverse": false },
    { "id": "cwp-18", "order": 18, "text": "I prefer working remotely most or all of the time.", "dimension": "remote_work", "reverse": false },
    { "id": "cwp-19", "order": 19, "text": "I prefer a regular mix of remote and on-site work.", "dimension": "hybrid_work", "reverse": false },
    { "id": "cwp-20", "order": 20, "text": "I prefer working at an employer or client site most or all of the time.", "dimension": "onsite_work", "reverse": false },
    { "id": "cwp-21", "order": 21, "text": "I am willing to work rotating or non-standard shifts.", "dimension": "shift_work", "reverse": false },
    { "id": "cwp-22", "order": 22, "text": "I am willing to work evenings or weekends regularly.", "dimension": "evenings_weekends", "reverse": false },
    { "id": "cwp-23", "order": 23, "text": "I would like work that requires regular travel.", "dimension": "travel", "reverse": false },
    { "id": "cwp-24", "order": 24, "text": "Maximizing income is a high priority in my next role.", "dimension": "income", "reverse": false },
    { "id": "cwp-25", "order": 25, "text": "Long-term job stability is a high priority for me.", "dimension": "stability", "reverse": false },
    { "id": "cwp-26", "order": 26, "text": "A clear path to greater responsibility is a high priority for me.", "dimension": "advancement", "reverse": false },
    { "id": "cwp-27", "order": 27, "text": "Frequent opportunities to learn new skills are a high priority for me.", "dimension": "learning", "reverse": false },
    { "id": "cwp-28", "order": 28, "text": "Finding the work meaningful or intrinsically interesting is a high priority for me.", "dimension": "meaningful_work", "reverse": false },
    { "id": "cwp-29", "order": 29, "text": "A low-chaos, manageable-stress environment is a high priority for me.", "dimension": "low_chaos", "reverse": false },
    { "id": "cwp-30", "order": 30, "text": "I want the option to work from different geographic locations.", "dimension": "geographic_flexibility", "reverse": false },
    { "id": "cwp-31", "order": 31, "text": "I am willing to relocate for the right role.", "dimension": "relocation", "reverse": false }
  ],
  "interpretationLimits": [
    "This questionnaire records current stated preferences and is not a validated psychometric instrument.",
    "Scores are not job recommendations and must not be treated as hard constraints.",
    "A missing profile preference remains unknown; completing this assessment does not silently write profile facts."
  ]
}
