{
  "instrumentId": "ipip-50-big-five-markers",
  "instrumentVersion": "1.0.0",
  "title": "Big Five — 50-item IPIP representation of Goldberg markers",
  "description": "The official 50-item IPIP representation of Goldberg's markers for the Big-Five factor structure.",
  "locale": "en",
  "source": {
    "name": "International Personality Item Pool (IPIP)",
    "authoritativeReference": "https://ipip.ori.org/new_ipip-50-item-scale.htm",
    "license": "Public domain",
    "licenseReference": "https://ipip.ori.org/new_ipip-50-item-scale.htm",
    "attribution": "50-item IPIP representation of the Goldberg (1992) markers for the Big-Five factor structure.",
    "requiredNotices": [
      "IPIP items are in the public domain.",
      "This result is not a diagnosis and no percentile or normative claim is made."
    ]
  },
  "definitionHash": "sha256:7620bee39d31e6acdcf9ffb5f77ce5ffb30e35dc940689226ac943d0a0c37a76",
  "scoringVersion": "ipip-standard-sum-v1",
  "answerScale": {
    "min": 1,
    "max": 5,
    "options": [
      { "value": 1, "label": "Very Inaccurate" },
      { "value": 2, "label": "Moderately Inaccurate" },
      { "value": 3, "label": "Neither Accurate Nor Inaccurate" },
      { "value": 4, "label": "Moderately Accurate" },
      { "value": 5, "label": "Very Accurate" }
    ]
  },
  "dimensions": [
    { "id": "extraversion", "label": "Extraversion" },
    { "id": "agreeableness", "label": "Agreeableness" },
    { "id": "conscientiousness", "label": "Conscientiousness" },
    { "id": "emotional_stability", "label": "Emotional Stability" },
    { "id": "intellect_imagination", "label": "Intellect / Imagination" }
  ],
  "items": [
    { "id": "ipip-01", "order": 1, "text": "Am the life of the party.", "dimension": "extraversion", "reverse": false },
    { "id": "ipip-02", "order": 2, "text": "Feel little concern for others.", "dimension": "agreeableness", "reverse": true },
    { "id": "ipip-03", "order": 3, "text": "Am always prepared.", "dimension": "conscientiousness", "reverse": false },
    { "id": "ipip-04", "order": 4, "text": "Get stressed out easily.", "dimension": "emotional_stability", "reverse": true },
    { "id": "ipip-05", "order": 5, "text": "Have a rich vocabulary.", "dimension": "intellect_imagination", "reverse": false },
    { "id": "ipip-06", "order": 6, "text": "Don't talk a lot.", "dimension": "extraversion", "reverse": true },
    { "id": "ipip-07", "order": 7, "text": "Am interested in people.", "dimension": "agreeableness", "reverse": false },
    { "id": "ipip-08", "order": 8, "text": "Leave my belongings around.", "dimension": "conscientiousness", "reverse": true },
    { "id": "ipip-09", "order": 9, "text": "Am relaxed most of the time.", "dimension": "emotional_stability", "reverse": false },
    { "id": "ipip-10", "order": 10, "text": "Have difficulty understanding abstract ideas.", "dimension": "intellect_imagination", "reverse": true },
    { "id": "ipip-11", "order": 11, "text": "Feel comfortable around people.", "dimension": "extraversion", "reverse": false },
    { "id": "ipip-12", "order": 12, "text": "Insult people.", "dimension": "agreeableness", "reverse": true },
    { "id": "ipip-13", "order": 13, "text": "Pay attention to details.", "dimension": "conscientiousness", "reverse": false },
    { "id": "ipip-14", "order": 14, "text": "Worry about things.", "dimension": "emotional_stability", "reverse": true },
    { "id": "ipip-15", "order": 15, "text": "Have a vivid imagination.", "dimension": "intellect_imagination", "reverse": false },
    { "id": "ipip-16", "order": 16, "text": "Keep in the background.", "dimension": "extraversion", "reverse": true },
    { "id": "ipip-17", "order": 17, "text": "Sympathize with others' feelings.", "dimension": "agreeableness", "reverse": false },
    { "id": "ipip-18", "order": 18, "text": "Make a mess of things.", "dimension": "conscientiousness", "reverse": true },
    { "id": "ipip-19", "order": 19, "text": "Seldom feel blue.", "dimension": "emotional_stability", "reverse": false },
    { "id": "ipip-20", "order": 20, "text": "Am not interested in abstract ideas.", "dimension": "intellect_imagination", "reverse": true },
    { "id": "ipip-21", "order": 21, "text": "Start conversations.", "dimension": "extraversion", "reverse": false },
    { "id": "ipip-22", "order": 22, "text": "Am not interested in other people's problems.", "dimension": "agreeableness", "reverse": true },
    { "id": "ipip-23", "order": 23, "text": "Get chores done right away.", "dimension": "conscientiousness", "reverse": false },
    { "id": "ipip-24", "order": 24, "text": "Am easily disturbed.", "dimension": "emotional_stability", "reverse": true },
    { "id": "ipip-25", "order": 25, "text": "Have excellent ideas.", "dimension": "intellect_imagination", "reverse": false },
    { "id": "ipip-26", "order": 26, "text": "Have little to say.", "dimension": "extraversion", "reverse": true },
    { "id": "ipip-27", "order": 27, "text": "Have a soft heart.", "dimension": "agreeableness", "reverse": false },
    { "id": "ipip-28", "order": 28, "text": "Often forget to put things back in their proper place.", "dimension": "conscientiousness", "reverse": true },
    { "id": "ipip-29", "order": 29, "text": "Get upset easily.", "dimension": "emotional_stability", "reverse": true },
    { "id": "ipip-30", "order": 30, "text": "Do not have a good imagination.", "dimension": "intellect_imagination", "reverse": true },
    { "id": "ipip-31", "order": 31, "text": "Talk to a lot of different people at parties.", "dimension": "extraversion", "reverse": false },
    { "id": "ipip-32", "order": 32, "text": "Am not really interested in others.", "dimension": "agreeableness", "reverse": true },
    { "id": "ipip-33", "order": 33, "text": "Like order.", "dimension": "conscientiousness", "reverse": false },
    { "id": "ipip-34", "order": 34, "text": "Change my mood a lot.", "dimension": "emotional_stability", "reverse": true },
    { "id": "ipip-35", "order": 35, "text": "Am quick to understand things.", "dimension": "intellect_imagination", "reverse": false },
    { "id": "ipip-36", "order": 36, "text": "Don't like to draw attention to myself.", "dimension": "extraversion", "reverse": true },
    { "id": "ipip-37", "order": 37, "text": "Take time out for others.", "dimension": "agreeableness", "reverse": false },
    { "id": "ipip-38", "order": 38, "text": "Shirk my duties.", "dimension": "conscientiousness", "reverse": true },
    { "id": "ipip-39", "order": 39, "text": "Have frequent mood swings.", "dimension": "emotional_stability", "reverse": true },
    { "id": "ipip-40", "order": 40, "text": "Use difficult words.", "dimension": "intellect_imagination", "reverse": false },
    { "id": "ipip-41", "order": 41, "text": "Don't mind being the center of attention.", "dimension": "extraversion", "reverse": false },
    { "id": "ipip-42", "order": 42, "text": "Feel others' emotions.", "dimension": "agreeableness", "reverse": false },
    { "id": "ipip-43", "order": 43, "text": "Follow a schedule.", "dimension": "conscientiousness", "reverse": false },
    { "id": "ipip-44", "order": 44, "text": "Get irritated easily.", "dimension": "emotional_stability", "reverse": true },
    { "id": "ipip-45", "order": 45, "text": "Spend time reflecting on things.", "dimension": "intellect_imagination", "reverse": false },
    { "id": "ipip-46", "order": 46, "text": "Am quiet around strangers.", "dimension": "extraversion", "reverse": true },
    { "id": "ipip-47", "order": 47, "text": "Make people feel at ease.", "dimension": "agreeableness", "reverse": false },
    { "id": "ipip-48", "order": 48, "text": "Am exacting in my work.", "dimension": "conscientiousness", "reverse": false },
    { "id": "ipip-49", "order": 49, "text": "Often feel blue.", "dimension": "emotional_stability", "reverse": true },
    { "id": "ipip-50", "order": 50, "text": "Am full of ideas.", "dimension": "intellect_imagination", "reverse": false }
  ],
  "interpretationLimits": [
    "Dimension totals range from 10 to 50 and are simple item sums after reverse scoring.",
    "Normalized scores only rescale the possible raw range to 0–100; they are not percentiles.",
    "Results are descriptive evidence, not diagnoses or career prescriptions."
  ]
}
